{
  "$schema": "./target-profile.schema.json",
  "target_id": "arduino_uno_q_stm32u585",
  "board_name": "Arduino UNO Q",
  "mcu": {
    "core": "ARM Cortex-M33",
    "part_number": "STM32U585",
    "clock_hz": 160000000,
    "fpu": "Single-precision FP32",
    "dsp_extensions": true,
    "flash_bytes": 2097152,
    "sram_bytes": 804864
  },
  "memory_limits": {
    "flash_limit_bytes": 2097152,
    "sram_limit_bytes": 804864,
    "max_tensor_arena_bytes": 524288,
    "max_feature_buffer_bytes": 65536
  },
  "toolchain": {
    "name": "arduino-cli",
    "cli_path": "C:\\Users\\MANAV\\AppData\\Local\\Programs\\Arduino IDE\\resources\\app\\lib\\backend\\resources\\arduino-cli.exe",
    "version": "1.4.1",
    "core_platform": "arduino:zephyr (1.0.0)",
    "compiler": "arm-zephyr-eabi-gcc",
    "core_installed": false,
    "status": "NOT_VERIFIED"
  },
  "bridge": {
    "transport": "UART",
    "device_path": "/dev/ttyMSM0",
    "baud_rate": 115200,
    "packet_format": "binary_8byte_framed",
    "status": "NOT_VERIFIED"
  },
  "supported_runtimes": [
    "tflite_micro",
    "cmsis_nn_baremetal"
  ],
  "supported_operators": [
    "CONV_2D",
    "DEPTHWISE_CONV_2D",
    "AVERAGE_POOL_2D",
    "FULLY_CONNECTED",
    "RELU",
    "SOFTMAX"
  ],
  "restrictions": [
    "Zero dynamic memory allocation in inference loop",
    "Static tensor arena and feature buffers only",
    "All weights resident in Flash (.rodata)",
    "Target is Arduino UNO Q (STM32U585), NOT Arduino UNO R4"
  ]
}